{
  "$schema": "https://json-schema.org/draft/2020-12/schema",
  "$id": "https://spec-kit-jira/contracts/neutral-interchange.schema.json",
  "title": "Neutral Interchange Document",
  "description": "The ONLY object crossing the engine to Jira-sink interface (Constitution VIII). Built by the engine, schema-validated before any write. Carries zero Jira identifiers: logical/neutral values only; the sink resolves them to ids. Any Atlassian-specific identifier appearing here is a schema violation.",
  "type": "object",
  "additionalProperties": false,
  "required": ["schema_version", "spec_ref", "routing", "epic", "stories"],
  "properties": {
    "schema_version": {
      "type": "string",
      "const": "1.0",
      "description": "Neutral document schema version; bumped in the same change that alters this schema."
    },
    "spec_ref": {
      "type": "object",
      "additionalProperties": false,
      "required": ["repo", "spec_slug", "folder"],
      "properties": {
        "repo": { "type": "string", "minLength": 1 },
        "spec_slug": { "type": "string", "pattern": "^[0-9]{3}-[a-z0-9-]+$" },
        "folder": { "type": "string", "minLength": 1 }
      }
    },
    "routing": {
      "type": "object",
      "additionalProperties": false,
      "required": ["project_key"],
      "properties": {
        "project_key": {
          "type": "string",
          "description": "Resolved by the engine from routing rules. A project KEY (public within the org), never a site URL, id, or coordinate.",
          "pattern": "^[A-Z][A-Z0-9_]+$"
        }
      }
    },
    "artifacts": {
      "description": "036 data-model.md §4 — the feature directory's artifact set, as the engine built it. OPTIONAL: a document produced before any artifact exists, or by a code path that does not publish, omits the key entirely; its absence is the off switch, exactly as it is for the task tier. The sink resolves the real file path from the feature directory plus `path` at upload time; the engine never hands it a filesystem handle.",
      "type": "array",
      "items": {
        "type": "object",
        "additionalProperties": false,
        "required": ["path", "hash", "size", "attachment_name"],
        "properties": {
          "path": {
            "description": "Relative to the feature directory, `/`-separated on every host. Never absolute and never containing a `..` segment: an absolute path would carry the operator's home directory into a document that is written to disk and compared byte-for-byte across ports and machines (Constitution VI).",
            "type": "string",
            "minLength": 1
          },
          "hash": { "type": "string", "pattern": "^[0-9a-f]{40}$" },
          "size": { "type": "integer", "minimum": 0 },
          "attachment_name": {
            "description": "The name the artifact carries as a Jira attachment: `path` with `/` replaced by `__` (research R7).",
            "type": "string",
            "minLength": 1
          }
        }
      }
    },
    "epic": {
      "type": "object",
      "additionalProperties": false,
      "required": ["strategy", "title", "description"],
      "properties": {
        "strategy": { "enum": ["per_repo", "per_feature"] },
        "title": { "type": "string", "minLength": 1 },
        "description": { "$ref": "#/$defs/content_blocks" }
      }
    },
    "stories": {
      "type": "array",
      "minItems": 1,
      "items": { "$ref": "#/$defs/story" }
    }
  },
  "$defs": {
    "story": {
      "type": "object",
      "additionalProperties": false,
      "required": ["local_id", "title", "description", "priority_logical"],
      "properties": {
        "local_id": { "type": "string", "minLength": 1, "description": "Engine-local id, stable across runs; NOT a Jira key." },
        "title": {
          "type": "string",
          "minLength": 1,
          "description": "Derived from the title ladder (FR-013); never empty, never from a ## Summary section."
        },
        "description": { "$ref": "#/$defs/content_blocks" },
        "acceptance_criteria": {
          "type": "array",
          "description": "Given/When/Then blocks (FR-015). Each clause is an inline sequence (feature 016), not a plain string — this replaces the crude global asterisk strip at engine/parse.sh:199, the partial workaround for the reported defect.",
          "items": {
            "type": "object",
            "additionalProperties": false,
            "required": ["given", "when", "then"],
            "properties": {
              "given": { "type": "array", "items": { "$ref": "#/$defs/inline" } },
              "when": { "type": "array", "items": { "$ref": "#/$defs/inline" } },
              "then": { "type": "array", "items": { "$ref": "#/$defs/inline" } }
            }
          }
        },
        "design": {
          "type": "array",
          "description": "Figma links and UX/UI guidance for the Design section (FR-016).",
          "items": {
            "type": "object",
            "additionalProperties": false,
            "required": ["kind", "value"],
            "properties": {
              "kind": { "enum": ["figma_link", "guidance"] },
              "label": { "type": "string" },
              "value": {
                "description": "An inline sequence when kind is 'guidance' (feature 016); stays a plain string URL when kind is 'figma_link' (a URL is not prose).",
                "oneOf": [{ "$ref": "#/$defs/inline" }, { "type": "string", "minLength": 1 }]
              }
            }
          }
        },
        "priority_logical": {
          "type": "string",
          "enum": ["P1", "P2", "P3"],
          "description": "Spec priority; the sink maps it to the project's priority field by logical name (FR-017). Never a Jira priority id."
        },
        "estimation": {
          "type": ["number", "null"],
          "description": "Declared estimation, create-only; the sink writes it to the discovered estimation field and never re-sends on update (FR-018)."
        },
        "tasks": {
          "type": "array",
          "items": { "$ref": "#/$defs/task" }
        }
      }
    },
    "task": {
      "type": "object",
      "additionalProperties": false,
      "required": ["local_id", "title", "description", "done", "marker"],
      "description": "A mirrored tasks.md line (feature 012). The `relation`/`link_type_logical` pair below is feature 001's original, never-implemented shape; 012 mirrors every task as a sub-task, so both stay optional rather than being invented as required.",
      "properties": {
        "local_id": {
          "type": "string",
          "description": "16 hex characters, or empty when the marker state is 'absent'."
        },
        "task_ref": {
          "type": "string",
          "description": "The task's own reference as written in tasks.md (T014, T014a)."
        },
        "title": { "type": "string", "minLength": 1 },
        "description": {
          "$ref": "#/$defs/content_blocks",
          "description": "The task's own text as marked spans. Feature 016 FR-017: a task line is author prose and obeys the same inline model every other description position obeys — a paragraph here carries `spans`, never a raw `text` string."
        },
        "attribution": {
          "type": "object",
          "additionalProperties": false,
          "properties": {
            "story_ordinal": { "type": ["integer", "null"] },
            "source": { "enum": ["tag", "heading", "none"] }
          }
        },
        "phase": { "type": "string" },
        "parallel": { "type": "boolean" },
        "files": { "type": "array", "items": { "type": "string" } },
        "depends_on": { "type": "array", "items": { "type": "string" } },
        "done": {
          "type": "boolean",
          "description": "The checkbox state in tasks.md; drives the completion transition (012 FR-033)."
        },
        "marker": {
          "type": "object",
          "description": "The durable task identifier spliced into tasks.md, in the shape engine/task_marker emits."
        },
        "relation": {
          "enum": ["subtask", "linked_story"],
          "description": "Task strategy chosen explicitly in config (001 FR-009). Not emitted by 012, which always mirrors as a sub-task."
        },
        "link_type_logical": {
          "type": "string",
          "description": "Required iff relation = linked_story; logical link-type name resolved by the sink."
        }
      }
    },

    "mark": {
      "type": "object",
      "additionalProperties": false,
      "required": ["kind"],
      "properties": {
        "kind": {
          "enum": ["bold", "italic", "monospace", "strikethrough", "link"],
          "description": "Neutral formatting vocabulary (feature 016). Deliberately lexically distinct from ADF's strong/em/code/strike (Constitution VIII)."
        },
        "href": {
          "type": "string",
          "pattern": "^https?://[^\\s]+$",
          "description": "Absolute http(s) target. Required iff kind is 'link'. The pattern is the schema-level backstop for FR-006: a non-http target can never reach Jira as a live link, because a validation failure blocks every downstream write."
        }
      },
      "allOf": [
        {
          "if": { "properties": { "kind": { "const": "link" } }, "required": ["kind"] },
          "then": { "required": ["href"] },
          "else": { "not": { "required": ["href"] } }
        }
      ]
    },

    "span": {
      "type": "object",
      "additionalProperties": false,
      "required": ["text", "marks"],
      "properties": {
        "text": {
          "type": "string",
          "description": "Literal characters a reader sees. Never carries the syntax of a converted construct (FR-002)."
        },
        "marks": {
          "type": "array",
          "items": { "$ref": "#/$defs/mark" },
          "description": "Always present, [] when unmarked, sorted alphabetically by kind. Always-emitted and always-sorted so the two ports cannot differ by an omitted key or by source nesting order (FR-015).",
          "uniqueItems": true
        }
      }
    },

    "inline": {
      "type": "array",
      "items": { "$ref": "#/$defs/span" },
      "description": "A sequence of marked runs (feature 016). Empty array represents empty text. Invariant not expressible in JSON Schema and enforced by the tokenizer instead (contract D1): no two consecutive spans carry equal marks."
    },

    "content_blocks": {
      "type": "object",
      "additionalProperties": false,
      "required": ["blocks"],
      "description": "A neutral, Jira-agnostic block tree. The sink renders it to ADF. NO ADF node names appear here.",
      "properties": {
        "blocks": {
          "type": "array",
          "minItems": 1,
          "items": {
            "type": "object",
            "additionalProperties": false,
            "required": ["type"],
            "properties": {
              "type": {
                "enum": ["heading", "paragraph", "bullet_list", "ordered_list", "code", "panel_ref"],
                "description": "Neutral block kinds. 'ordered_list' is new in feature 016 (FR-008). 'panel_ref' marks where the sink should place a panel (e.g. acceptance criteria); the engine does not know what a Jira panel is."
              },
              "level": { "type": "integer", "minimum": 1, "maximum": 6 },
              "spans": { "$ref": "#/$defs/inline" },
              "items": {
                "type": "array",
                "items": { "$ref": "#/$defs/inline" },
                "description": "List items. Each item is an inline sequence (feature 016; was an array of plain strings before it)."
              },
              "text": {
                "type": "string",
                "description": "Code block body ONLY. Deliberately plain: FR-007 forbids interpreting markup inside code, and keeping this position a string makes that a property of the schema rather than a rule the tokenizer must remember."
              },
              "ref": { "type": "string", "description": "For panel_ref: a logical section name, e.g. 'acceptance_criteria' or 'design'." }
            },
            "allOf": [
              {
                "if": { "properties": { "type": { "enum": ["heading", "paragraph"] } }, "required": ["type"] },
                "then": { "required": ["spans"] }
              },
              {
                "if": { "properties": { "type": { "enum": ["bullet_list", "ordered_list"] } }, "required": ["type"] },
                "then": { "required": ["items"] }
              },
              {
                "if": { "properties": { "type": { "const": "code" } }, "required": ["type"] },
                "then": { "required": ["text"] }
              },
              {
                "if": { "properties": { "type": { "const": "panel_ref" } }, "required": ["type"] },
                "then": { "required": ["ref"] }
              }
            ]
          }
        }
      }
    }
  }
}
